<?xml version="1.0" encoding="UTF-8"?>
<dataroot xmlns:od="urn:schemas-microsoft-com:officedata" xmlns:xsi="http://www.w3.org/2001/XMLSchema-instance"  xsi:noNamespaceSchemaLocation="24_Sections.xsd" generated="2026-06-08T16:12:02">
<_x0032_4_Sections>
<SectionID>204</SectionID>
<SectionName>Section:001.003_MTT-35-CG-ES-1</SectionName>
<SectionPosition>3</SectionPosition>
<ParentSectionID>171</ParentSectionID>
</_x0032_4_Sections>
<_x0032_4_Sections>
<SectionID>205</SectionID>
<SectionName>Section:001.003_MTT-35-Y-EN-2</SectionName>
<SectionPosition>3</SectionPosition>
<ParentSectionID>172</ParentSectionID>
</_x0032_4_Sections>
<_x0032_4_Sections>
<SectionID>206</SectionID>
<SectionName>Section:001.003_MTT-35-CG-EN-2</SectionName>
<SectionPosition>3</SectionPosition>
<ParentSectionID>173</ParentSectionID>
</_x0032_4_Sections>
<_x0032_4_Sections>
<SectionID>207</SectionID>
<SectionName>Section:001.003_MTT-35-Y-ES-2</SectionName>
<SectionPosition>3</SectionPosition>
<ParentSectionID>174</ParentSectionID>
</_x0032_4_Sections>
<_x0032_4_Sections>
<SectionID>208</SectionID>
<SectionName>Section:001.003_MTT-35-CG-ES-2</SectionName>
<SectionPosition>3</SectionPosition>
<ParentSectionID>175</ParentSectionID>
</_x0032_4_Sections>
<_x0032_4_Sections>
<SectionID>209</SectionID>
<SectionName>Section:001.003_MTT-35-CG-EN-3</SectionName>
<SectionPosition>3</SectionPosition>
<ParentSectionID>176</ParentSectionID>
</_x0032_4_Sections>
<_x0032_4_Sections>
<SectionID>210</SectionID>
<SectionName>Section:001.003_MTT-35-Y-NO</SectionName>
<SectionPosition>3</SectionPosition>
<ParentSectionID>177</ParentSectionID>
</_x0032_4_Sections>
<_x0032_4_Sections>
<SectionID>211</SectionID>
<SectionName>Section:001.003_MTT-35-CG-NO</SectionName>
<SectionPosition>3</SectionPosition>
<ParentSectionID>178</ParentSectionID>
</_x0032_4_Sections>
<_x0032_4_Sections>
<SectionID>212</SectionID>
<SectionName>Section:001.004_MTT-35-Y-EN-1</SectionName>
<SectionPosition>4</SectionPosition>
<ParentSectionID>168</ParentSectionID>
</_x0032_4_Sections>
<_x0032_4_Sections>
<SectionID>213</SectionID>
<SectionName>Section:001.004_MTT-35-CG-EN-1</SectionName>
<SectionPosition>4</SectionPosition>
<ParentSectionID>169</ParentSectionID>
</_x0032_4_Sections>
<_x0032_4_Sections>
<SectionID>214</SectionID>
<SectionName>Section:001.004_MTT-35-Y-ES-1</SectionName>
<SectionPosition>4</SectionPosition>
<ParentSectionID>170</ParentSectionID>
</_x0032_4_Sections>
<_x0032_4_Sections>
<SectionID>215</SectionID>
<SectionName>Section:001.004_MTT-35-CG-ES-1</SectionName>
<SectionPosition>4</SectionPosition>
<ParentSectionID>171</ParentSectionID>
</_x0032_4_Sections>
<_x0032_4_Sections>
<SectionID>216</SectionID>
<SectionName>Section:001.004_MTT-35-Y-EN-2</SectionName>
<SectionPosition>4</SectionPosition>
<ParentSectionID>172</ParentSectionID>
</_x0032_4_Sections>
<_x0032_4_Sections>
<SectionID>217</SectionID>
<SectionName>Section:001.004_MTT-35-CG-EN-2</SectionName>
<SectionPosition>4</SectionPosition>
<ParentSectionID>173</ParentSectionID>
</_x0032_4_Sections>
<_x0032_4_Sections>
<SectionID>218</SectionID>
<SectionName>Section:001.004_MTT-35-Y-ES-2</SectionName>
<SectionPosition>4</SectionPosition>
<ParentSectionID>174</ParentSectionID>
</_x0032_4_Sections>
<_x0032_4_Sections>
<SectionID>219</SectionID>
<SectionName>Section:001.004_MTT-35-CG-ES-2</SectionName>
<SectionPosition>4</SectionPosition>
<ParentSectionID>175</ParentSectionID>
</_x0032_4_Sections>
<_x0032_4_Sections>
<SectionID>220</SectionID>
<SectionName>Section:001.004_MTT-35-CG-EN-3</SectionName>
<SectionPosition>4</SectionPosition>
<ParentSectionID>176</ParentSectionID>
</_x0032_4_Sections>
<_x0032_4_Sections>
<SectionID>221</SectionID>
<SectionName>Section:001.004_MTT-35-Y-NO</SectionName>
<SectionPosition>4</SectionPosition>
<ParentSectionID>177</ParentSectionID>
</_x0032_4_Sections>
<_x0032_4_Sections>
<SectionID>222</SectionID>
<SectionName>Section:001.004_MTT-35-CG-NO</SectionName>
<SectionPosition>4</SectionPosition>
<ParentSectionID>178</ParentSectionID>
</_x0032_4_Sections>
<_x0032_4_Sections>
<SectionID>223</SectionID>
<SectionName>Section:001.005_MTT-35-Y-EN-1</SectionName>
<SectionPosition>5</SectionPosition>
<ParentSectionID>168</ParentSectionID>
</_x0032_4_Sections>
<_x0032_4_Sections>
<SectionID>224</SectionID>
<SectionName>Section:001.005_MTT-35-CG-EN-1</SectionName>
<SectionPosition>5</SectionPosition>
<ParentSectionID>169</ParentSectionID>
</_x0032_4_Sections>
<_x0032_4_Sections>
<SectionID>225</SectionID>
<SectionName>Section:001.005_MTT-35-Y-ES-1</SectionName>
<SectionPosition>5</SectionPosition>
<ParentSectionID>170</ParentSectionID>
</_x0032_4_Sections>
<_x0032_4_Sections>
<SectionID>226</SectionID>
<SectionName>Section:001.005_MTT-35-CG-ES-1</SectionName>
<SectionPosition>5</SectionPosition>
<ParentSectionID>171</ParentSectionID>
</_x0032_4_Sections>
<_x0032_4_Sections>
<SectionID>227</SectionID>
<SectionName>Section:001.005_MTT-35-Y-EN-2</SectionName>
<SectionPosition>5</SectionPosition>
<ParentSectionID>172</ParentSectionID>
</_x0032_4_Sections>
<_x0032_4_Sections>
<SectionID>228</SectionID>
<SectionName>Section:001.005_MTT-35-CG-EN-2</SectionName>
<SectionPosition>5</SectionPosition>
<ParentSectionID>173</ParentSectionID>
</_x0032_4_Sections>
<_x0032_4_Sections>
<SectionID>229</SectionID>
<SectionName>Section:001.005_MTT-35-Y-ES-2</SectionName>
<SectionPosition>5</SectionPosition>
<ParentSectionID>174</ParentSectionID>
</_x0032_4_Sections>
<_x0032_4_Sections>
<SectionID>230</SectionID>
<SectionName>Section:001.005_MTT-35-CG-ES-2</SectionName>
<SectionPosition>5</SectionPosition>
<ParentSectionID>175</ParentSectionID>
</_x0032_4_Sections>
<_x0032_4_Sections>
<SectionID>231</SectionID>
<SectionName>Section:001.005_MTT-35-CG-EN-3</SectionName>
<SectionPosition>5</SectionPosition>
<ParentSectionID>176</ParentSectionID>
</_x0032_4_Sections>
<_x0032_4_Sections>
<SectionID>232</SectionID>
<SectionName>Section:001.005_MTT-35-Y-NO</SectionName>
<SectionPosition>5</SectionPosition>
<ParentSectionID>177</ParentSectionID>
</_x0032_4_Sections>
<_x0032_4_Sections>
<SectionID>233</SectionID>
<SectionName>Section:001.005_MTT-35-CG-NO</SectionName>
<SectionPosition>5</SectionPosition>
<ParentSectionID>178</ParentSectionID>
</_x0032_4_Sections>
<_x0032_4_Sections>
<SectionID>234</SectionID>
</_x0032_4_Sections>
<_x0032_4_Sections>
<SectionID>235</SectionID>
</_x0032_4_Sections>
<_x0032_4_Sections>
<SectionID>236</SectionID>
</_x0032_4_Sections>
<_x0032_4_Sections>
<SectionID>237</SectionID>
</_x0032_4_Sections>
<_x0032_4_Sections>
<SectionID>238</SectionID>
</_x0032_4_Sections>
<_x0032_4_Sections>
<SectionID>239</SectionID>
</_x0032_4_Sections>
<_x0032_4_Sections>
<SectionID>240</SectionID>
</_x0032_4_Sections>
<_x0032_4_Sections>
<SectionID>241</SectionID>
</_x0032_4_Sections>
<_x0032_4_Sections>
<SectionID>242</SectionID>
</_x0032_4_Sections>
<_x0032_4_Sections>
<SectionID>243</SectionID>
</_x0032_4_Sections>
<_x0032_4_Sections>
<SectionID>244</SectionID>
</_x0032_4_Sections>
<_x0032_4_Sections>
<SectionID>245</SectionID>
</_x0032_4_Sections>
<_x0032_4_Sections>
<SectionID>246</SectionID>
</_x0032_4_Sections>
<_x0032_4_Sections>
<SectionID>247</SectionID>
</_x0032_4_Sections>
<_x0032_4_Sections>
<SectionID>248</SectionID>
</_x0032_4_Sections>
<_x0032_4_Sections>
<SectionID>249</SectionID>
</_x0032_4_Sections>
<_x0032_4_Sections>
<SectionID>250</SectionID>
</_x0032_4_Sections>
<_x0032_4_Sections>
<SectionID>251</SectionID>
</_x0032_4_Sections>
<_x0032_4_Sections>
<SectionID>252</SectionID>
</_x0032_4_Sections>
<_x0032_4_Sections>
<SectionID>253</SectionID>
</_x0032_4_Sections>
<_x0032_4_Sections>
<SectionID>254</SectionID>
</_x0032_4_Sections>
<_x0032_4_Sections>
<SectionID>255</SectionID>
</_x0032_4_Sections>
<_x0032_4_Sections>
<SectionID>256</SectionID>
<SectionName>Section:001.000_PHQ-9-A-EN-UK</SectionName>
<SectionPosition>1</SectionPosition>
<ParentInstrumentID>106</ParentInstrumentID>
</_x0032_4_Sections>
<_x0032_4_Sections>
<SectionID>257</SectionID>
<SectionName>Section:001.000_PHQ-9-A-EN-US-HK</SectionName>
<SectionPosition>1</SectionPosition>
<ParentInstrumentID>181</ParentInstrumentID>
</_x0032_4_Sections>
<_x0032_4_Sections>
<SectionID>258</SectionID>
<SectionName>Section:001.000_PHQ-8-A-EN-UK</SectionName>
<SectionPosition>1</SectionPosition>
<ParentInstrumentID>182</ParentInstrumentID>
</_x0032_4_Sections>
<_x0032_4_Sections>
<SectionID>259</SectionID>
<SectionName>Section:001.000_PHQ-8-A-EN-CA</SectionName>
<SectionPosition>1</SectionPosition>
<ParentInstrumentID>183</ParentInstrumentID>
</_x0032_4_Sections>
<_x0032_4_Sections>
<SectionID>260</SectionID>
<SectionName>Section:001.000_PHQ-8-A-EN-AU</SectionName>
<SectionPosition>1</SectionPosition>
<ParentInstrumentID>184</ParentInstrumentID>
</_x0032_4_Sections>
<_x0032_4_Sections>
<SectionID>261</SectionID>
<SectionName>Section:001.000_PHQ-9-A-EN-AU</SectionName>
<SectionPosition>1</SectionPosition>
<ParentInstrumentID>185</ParentInstrumentID>
</_x0032_4_Sections>
<_x0032_4_Sections>
<SectionID>262</SectionID>
<SectionName>Section:001.000_PHQ-4-A-EN</SectionName>
<SectionPosition>1</SectionPosition>
<ParentInstrumentID>187</ParentInstrumentID>
</_x0032_4_Sections>
<_x0032_4_Sections>
<SectionID>263</SectionID>
<SectionName>Section:001.000_PHQ-9-A-FR-FR</SectionName>
<SectionPosition>1</SectionPosition>
<ParentInstrumentID>188</ParentInstrumentID>
</_x0032_4_Sections>
<_x0032_4_Sections>
<SectionID>264</SectionID>
<SectionName>Section:001.000_PHQ-9-A-EN-IN</SectionName>
<SectionPosition>1</SectionPosition>
<ParentInstrumentID>193</ParentInstrumentID>
</_x0032_4_Sections>
<_x0032_4_Sections>
<SectionID>265</SectionID>